,0
0,"Because of Regents low booking rates, the band could record for extended periods rather than the usual three-hour blocks common at other studios."
1,"Fossils from this time have been found in Asia and Europe, for instance in the red slate fossil beds of Niedermoschel near Mainz, Germany."
2,Id grown sick to death of the whole Maharishi guru shit and the beads and bells.
3,"Jagger read an excerpt from Shelleys poem Adonaxc3xafs, an elegy written on the death of his friend John Keats."
4,"The band got three times a new acts typical royalty rate, full artistic control of recordings and ownership of the recording master tapes."
5,The multisegmented legs end in two to five small segments called tarsi.
6,"In July 2007 Modi completed 2,063 consecutive days as chief minister of Gujarat, making him the longest-serving holder of that post, and the BJP won 122 of 182 state-assembly seats in that years election."
7,"Modis family belonged to the Modh-Ghanchi-Teli (oil-presser) community, which is categorised as an Other Backward Class by the Indian government.As a child, Modi helped his father sell tea at the Vadnagar railway station, and said that he later ran a tea stall with his brother near a bus terminus."
8,One project that did particularly well for Bachchan was Sanjay Leela Bhansalis Black (2005).
9,"Aquatic beetles including the Dytiscidae (diving beetles), Haliplidae, and many species of Hydrophilidae, the legs, often the last pair, are modified for swimming, typically with rows of long hairs."
